StoryID	Title	Summary	Director	Writer	AirDate	SeriesID	Season	Episode	ObjectCharacters	MainCharacters	MinorCharacters
tng5x13	The Masterpiece Society	The Enterprise helps a far-flung eugenic human colony avoid destruction, but upsets its delicate balance by ending 200 years of isolation.  	Winrich Kolbe	James Kahn and Adam Belanoff	1992-02-10	tng	5	13	Deanna Troi	Jean-Luc Picard, Aaron Conor	Geordi La Forge, Hannah Bates, Martin Benbeck
tng5x14	Conundrum	The crew's memory is erased, and they discover they are being manipulated into being the key part of a war.  	Les Landau	Paul Schiffer	1992-02-17	tng	5	14		Keiran MacDuff, William T. Riker, Jean-Luc Picard	Ro Laren, Deanna Troi, Worf, Data, Geordi La Forge, Beverly Crusher
tng5x15	Power Play	Troi , O'Brien , and Data are possessed by entities who want control of the ship.  	David Livingston	Paul Ruben and Maurice Hurley	1992-02-24	tng	5	15		Jean-Luc Picard, William T. Riker, Deanna Troi, Miles O'Brien, Data	Worf, Keiko O'Brien, Geordi La Forge, Ro Laren, Beverly Crusher
tng5x16	Ethics	Worf becomes paralyzed—and suicidal—and Dr. Crusher consults a risk-taking researcher to save his life.  	Chip Chalmers	Sara Charno  and  Stuart Charno	1992-03-02	tng	5	16	Worf, Beverly Crusher	Toby Russell	Jean-Luc Picard, Alexander Rozhenko, William T. Riker, Deanna Troi
tng5x17	The Outcast	Riker falls in love with an androgynous person after rescuing some others trapped in "null space."  	Robert Scheerer	Jeri Taylor	1992-03-16	tng	5	17	William T. Riker	Soren	Jean-Luc Picard, Noor, Worf
tng5x18	Cause and Effect	The Enterprise becomes stuck in a causality loop, but the crew retain some memory of previous instances. Guest star Kelsey Grammer as Morgan Bateson.  	Jonathan Frakes	Brannon Braga	1992-03-23	tng	5	18	Beverly Crusher	Jean-Luc Picard	Geordi La Forge, William T. Riker
tng5x19	The First Duty	Wesley is questioned over a Starfleet Academy flight-training accident. Guest star Ray Walston as Boothby.  	Paul Lynch	Ronald D. Moore  and  Naren Shankar	1992-03-30	tng	5	19	Wesley Crusher	Jean-Luc Picard, Nicholas Locarno	Beverly Crusher, Geordi La Forge, Data, Boothby, Sito Jaxa, Jean Hajar, Brand, Albert
tng5x20	Cost of Living	Deanna 's mother, Lwaxana , arrives to marry a man she has never met. Worf has difficulty rearing Alexander, which is exacerbated when Lwaxana takes the boy under her wing.  	Winrich Kolbe	Peter Allan Fields	1992-04-20	tng	5	20	Alexander Rozhenko	Lwaxana Troi	Deanna Troi, Worf, Jean-Luc Picard, Campio, Geordi La Forge, Data
tng5x21	The Perfect Mate	Picard forces himself to resist the charms of a female empathic metamorph, who is sent to marry an alien leader as a peace offering. Guest star Famke Janssen as Kamala.  	Cliff Bole	René Echevarria and Gary Perconte	1992-04-27	tng	5	21	Jean-Luc Picard, Kamala		William T. Riker, Beverly Crusher, Briam, Par Lenor, Qol, Alrik
tng5x22	Imaginary Friend	A child's imaginary playmate takes on real form and threatens the well-being of the Enterprise .  	Gabrielle Beaumont	Jean Louise Matthias  and  Ronald Wilkerson and Richard Fliegel	1992-05-04	tng	5	22	Clara Sutter	Deanna Troi, Isabella	Jean-Luc Picard, Geordi La Forge, Data, Daniel Sutter
tng5x23	I Borg	The Enterprise rescues a Borg survivor, and Picard plans to use him as a weapon against his nemesis by exposing him to a computer virus .  	Robert Lederman	René Echevarria	1992-05-11	tng	5	23	Hugh	Jean-Luc Picard, Geordi La Forge	Beverly Crusher, Guinan
tng5x24	The Next Phase	A transporter accident traps Geordi and Ensign Ro out of phase; while the others plan their funeral they must find a way to reverse the process and save the Enterprise from destruction.  	David Carson	Ronald D. Moore	1992-05-18	tng	5	24	Geordi La Forge, Ro Laren		Jean-Luc Picard, Data, William T. Riker, Worf
tng5x25	The Inner Light	A space probe creates a telepathic tether and causes Picard to experience, in twenty-five minutes, a lifetime as a married man on a world that was destroyed a millennium ago.  	Peter Lauritson	Morgan Gendel	1992-06-01	tng	5	25	Jean-Luc Picard	Eline	Beverly Crusher, William T. Riker, Data, Batai, Meribor, Batai son of Kamin
tng5x26	Time's Arrow	A 500-year-old artifact is uncovered on Earth: Data 's severed head. The Enterprise investigates alien involvement in Earth's past and Data fulfills his destiny.  	Les Landau	Joe Menosky	1992-06-15	tng	5	26	Data	Jean-Luc Picard	William T. Riker, Geordi La Forge, Deanna Troi, Worf, Guinan, Jack London
tng6x01	Time's Arrow, Part II	The Enterprise crew follow Data to San Francisco of the 1890s. The crew deals with Samuel Clemens (and run into Jack London), while trying to find a way to prevent aliens from interfering with 19th-century Earth. Guest star: Jerry Hardin as Samuel Clemens.  	Les Landau	Joe Menosky	1992-09-21	tng	6	1	Mark Twain	Data, Jean-Luc Picard, Guinan	Beverly Crusher, Deanna Troi, Riker Jack London, Geordi La Forge
tng6x02	Realm of Fear	Barclay must overcome his fear of the transporter to solve a mystery.  	Cliff Bole	Brannon Braga	1992-09-28	tng	6	2	Reginald Barclay		Geordi La Forge, Beverly Crusher, Miles O'Brien, Deanna Troi
tng6x03	Man of the People	A psychic ambassador uses Deanna 's mind to influence the outcome of his mission.  	Winrich Kolbe	Frank Abatemarco	1992-10-05	tng	6	3	Deanna Troi, Ves Alkar		Jean-Luc Picard, William T. Riker, Beverly Crusher, Sev Maylor
tng6x04	Relics	The Enterprise investigates a vessel that crashed on the surface of a Dyson sphere 75 years ago. An undegraded pattern is found in the transporter buffer, that of Mr. Scott . Feeling out of place and obsolete, Scotty agrees to return to his vessel with Geordi to help restore the logs, and they become the only hope when the Enterprise is accidentally pulled inside the sphere.  	Alexander Singer	Ronald D. Moore	1992-10-12	tng	6	4	Montgomery Scott	Geordi La Forge	Jean-Luc Picard, William T. Riker, Data
tng6x05	Schisms	Several members of the crew are abducted and experimented on while they sleep.  	Robert Wiemer	Jean Louise Matthias  and  Ron Wilkerson	1992-10-19	tng	6	5		William T. Riker, Data, Geordi La Forge	Jean-Luc Picard, Deanna Troi, Beverly Crusher, Spot
tng6x06	True Q	Q reveals a secret about a young woman from Kansas who is visiting the Enterprise . Guest star: Olivia d'Abo as Amanda Rogers.  	Robert Scheerer	René Echevarria	1992-10-26	tng	6	6	Amanda Rogers	Jean-Luc Picard, Q	Beverly Crusher, William T. Riker, Data
tng6x07	Rascals	A transporter malfunction turns Picard , Keiko , Ro and Guinan into children, who become the ship's only hope when they are left aboard while the adult crew are forced to perform dangerous labor by Ferengi pirates.  	Adam Nimoy	Ward Botsford  and  Diana Dru Botsford and Michael Piller	1992-11-02	tng	6	7	Jean-Luc Picard, Guinan	Ro Laren	William T. Riker, Beverly Crusher, Miles O'Brien, Keiko O'Brien, Deanna Troi, Geordi La Forge, Alexander Rozhenko, Lurin
tng6x08	A Fistful of Datas	Data 's mind is connected to the ship's computer, which creates unforeseen effects on the holodeck .  	Patrick Stewart	Robert Hewitt Wolfe	1992-11-09	tng	6	8	Worf	Alexander Rozhenko, Data	Jean-Luc Picard, Geordi La Forge, Deanna Troi, Eli Hollander, Annie Meyers
tng6x09	The Quality of Life	Data observes self-guided "tools" used at a mining station display signs of sentience, and fights for their preservation, even risking Captain Picard's life on the ground that it is unacceptable to kill one sentient being to save another.  	Jonathan Frakes	L.J. Scott	1992-11-16	tng	6	9	Data	Farallon	Jean-Luc Picard, William T. Riker, Beverly Crusher, Geordi La Forge
tng6x10	Chain of Command, Part I	Captain Jellico is assigned command of the Enterprise , while Picard is sent on a covert mission into Cardassian territory. Guest star: Ronny Cox as Edward Jellico.  	Robert Scheerer	Frank Abatemarco	1992-12-14	tng	6	10		Jean-Luc Picard, Worf, Beverly Crusher, Edward Jellico, William T. Riker	Alynna Nechayev, Deanna Troi, Lemec, Solok, Madred
tng6x11	Chain of Command, Part II	Picard , having been captured, is tortured by a sadistic Cardassian interrogator (played by David Warner).  	Les Landau	Frank Abatemarco	1992-12-21	tng	6	11	Jean-Luc Picard	Edward Jelllico, Madred	William T. Riker, Geordi La Forge, Deanna Troi
tng6x12	Ship in a Bottle	Barclay accidentally awakens Prof. Moriarty on the holodeck , who uses the powers at his disposal to coerce the crew into finding a way to allow him to leave the holodeck. Guest star: Daniel Davis as Professor Moriarty.  	Alexander Singer	René Echevarria	1993-01-25	tng	6	12	James Moriarty	Jean-Luc Picard, Data	Reginald Barclay, Geordi La Forge, William T. Riker, Regina Bartholomew
tng6x13	Aquiel	Geordi falls for an alien Starfleet officer who is suspected of murder. Guest star Renée Jones as Aquiel Uhnari.  	Cliff Bole	Jeri Taylor	1993-02-01	tng	6	13	Geordi La Forge	Aquiel Uhnari	Jean-Luc Picard, William T. Riker, Beverly Crusher, Morag, Torak, Worf, Shianna
tng6x14	Face of the Enemy	Deanna is involuntarily recruited to assist in the transport of Romulan defectors across the border.  	Gabrielle Beaumont	René Echevarria	1993-02-08	tng	6	14	Deanna Troi	Stefan DeSeve, Toreth	Jean-Luc Picard, N'Vek
tng6x15	Tapestry	An accident kills Picard , and he finds an afterlife with Q analyzing his past choices.  	Les Landau	Ronald D. Moore	1993-02-15	tng	6	15	Jean-Luc Picard	Q	Cortan Zweller, Marta Batanides, William T. Riker, Deanna Troi
tng6x16	Birthright, Part I	Worf is told on Deep Space Nine his father is alive, and being held prisoner by the Romulans . Meanwhile an engineering experiment accidentally results in Data 's first dream. Guest star: James Cromwell as Jaglom Shrek.  	Winrich Kolbe	Brannon Braga	1993-02-22	tng	6	16	Worf, Data		Jaglom Shrek, Julian Bashir, Geordi La Forge, Noonian Soong
tng6x17	Birthright, Part II	Worf , now a prisoner, tries to teach the Klingon refugees the ways of the warrior.  	Dan Curry	René Echevarria	1993-03-01	tng	6	17	Worf	Ba'el	Tokath, Gi'ral, L'Kor, Jean-Luc Picard, Toq
tng6x18	Starship Mine	Thieves attempt to steal trilithium from the Enterprise during a Baryon sweep at the Remmler Array , and Picard alone must thwart them.  	Cliff Bole	Morgan Gendel	1993-03-29	tng	6	18	Jean-Luc Picard	Kelsey	Beverly Crusher, Data, William T. Riker, Geordi La Forge, Deanna Troi, Calvin Hutchinson, Devon, Satler, Pomet, Orton
tng6x19	Lessons	Picard becomes involved with a woman who is serving on the Enterprise , but he must send her into a dangerous mission.  	Robert Wiemer	Ron Wilkerson  and  Jean Louise Matthias	1993-04-05	tng	6	19	Jean-Luc Picard, Nella Daren		Data, William T. Riker, Beverly Crusher
tng6x20	The Chase	Picard tries to solve an ancient genetic mystery uncovered by his archaeological mentor, and faces stiff competition. Guest star: Norman Lloyd as Richard Galen.  	Jonathan Frakes	Ronald D. Moore  and  Joe Menosky	1993-04-26	tng	6	20		Jean-Luc Picard, Richard Galen	William T. Riker, Beverly Crusher, Data, Nu'Daq, Gul Ocett, primordial humanoid
tng6x21	Frame of Mind	Riker finds himself prisoner in an alien mental institution, which resembles scenes from Beverly's play.  	James L. Conway	Brannon Braga	1993-05-03	tng	6	21	William T. Riker	Suna	Jean-Luc Picard, Beverly Crusher, Deanna Troi, Syrus, Mavek, Jaya
tng6x22	Suspicions	Dr. Crusher risks her career to solve the murder of Ferengi scientist Dr. Reyga and vindicate his research.  	Cliff Bole	Joe Menosky and Naren Shankar	1993-05-10	tng	6	22	Beverly Crusher	Reyga	Guinan, Jean-Luc Picard, Ogawa, Data, T'Pan, Jo'Bril, Kurak
tng6x23	Rightful Heir	Worf experiences a crisis of faith, and travels to a Klingon holy site where the mythic figure Kahless returns to lead the Klingon people.  	Winrich Kolbe	James E. Brooks	1993-05-17	tng	6	23	Worf	Kahless (clone)	Koroth, Gowron, Jean-Luc Picard
tng6x24	Second Chances	Riker encounters a duplicate of himself created by a transporter malfunction stranded on a planet. "Thomas" vies for Deanna's affections.  	LeVar Burton	Michael Medlock	1993-05-24	tng	6	24	William T. Riker, Thomas Riker	Deanna Troi	Data, Jean-Luc Picard, Beverly Crusher, Worf
tng6x25	Timescape	The Enterprise is caught in temporal stasis, and on the brink of destruction by a Romulan ship.  	Adam Nimoy	Brannon Braga	1993-06-14	tng	6	25		Jean-Luc Picard, Geordi La Forge, Deanna Troi, Data	William T. Riker
tng6x26	Descent	The crew encounter a group of Borg acting individually, and Data briefly experiences emotions. Professor Stephen Hawkings makes a guest appearance.  	Alexander Singer	Jeri Taylor	1993-06-21	tng	6	26	Data	Jean-Luc Picard	Alynna Nechayev, Deanna Troi, William T. Riker, Worf, Geordi La Forge, Beverly Crusher, Albert Einstein (hologram), Isaac Newton (hologram), Stephen Hawking (hologram)
tng7x01	Descent, Part II	The Borg are being led by Lore. Data falls under his control by being fed negative emotions.  	Alexander Singer	René Echevarria	1993-09-20	tng	7	1	Data	Jean-Luc Picard, Lore, Beverly Crusher, Geordi La Forge	Deanna Troi, William T. Riker, Hugh, Worf, Taitt, Barnaby
tng7x02	Liaisons	Worf and Troi reluctantly play host to two Lyraan ambassadors, while Picard crashes in a shuttle with another Lyraan. He is rescued by a human female who exhibits strange behavior.  	Cliff Bole	Roger Eschbacher  and  Jaq Greenspon	1993-09-27	tng	7	2	Jean-Luc Picard	Worf, Deanna Troi, Voval, Byleth, Loquel	William T. Riker
tng7x03	Interface	Geordi tries to rescue his mother's starship via a remotely controlled probe.  	Robert Wiemer	Joe Menosky	1993-10-04	tng	7	3	Geordi La Forge	Data	Beverly Crusher, Jean-Luc Picard, William T. Riker, Silvia La Forge
tng7x04	Gambit, Part I	The Enterprise crew investigate the apparent murder of Captain Picard during an archaeological trip. Riker is kidnapped by mercenaries and finds Picard working as part of their crew.  	Peter Lauritson	Christopher Hatton and Naren Shankar	1993-10-11	tng	7	4	Jean-Luc Picard	William T. Riker, Arctus Baran	Deanna Troi, Worf, Data, Yranac, Tallera, Vekor, Narik
tng7x05	Gambit, Part II	Picard and Riker help mercenaries collect archaeological artifacts to prevent an ancient Vulcan weapon falling into the wrong hands.  	Alexander Singer	Naren Shankar	1993-10-18	tng	7	5	Jean-Luc Picard	William T. Riker, Tallera, Arctus Baran	Vekor, Narik, Koral, Data, Worf, Beverly Crusher
tng7x06	Phantasms	Data experiences strange dreams, while the Enterprise has issues with its new Warp-core. But all is not as it seems.  	Patrick Stewart	Brannon Braga	1993-10-25	tng	7	6	Data		Deanna Troi, Jean-Luc Picard, Beverly Crusher, William T. Riker, Geordi La Forge, Sigmund Freud (hologram), Spot
tng7x07	Dark Page	A psychic breakdown puts Lwaxana Troi in a coma, and Deanna works to save her life. Features a young Kirsten Dunst , playing the little girl Hedril.  	Les Landau	Hilary J. Bader	1993-11-01	tng	7	7	Lwaxana Troi	Deanna Troi, Maques	Hedril, Beverly Crusher, Jean-Luc Picard, Kestra, Ian Andrew Troi
tng7x08	Attached	Reclusive aliens imprison Picard and Dr. Crusher on charges of espionage, and experimental implants linking their minds telepathically cause them to face their latent feelings for each other.  	Jonathan Frakes	Nicholas Sagan	1993-11-08	tng	7	8	Jean-Luc Picard, Beverly Crusher		William T. Riker, Deanna Troi, Mauric
tng7x09	Force of Nature	A pair of scientists show that warp drives are harming the fabric of space.  	Robert Lederman	Naren Shankar	1993-11-15	tng	7	9		Geordi La Forge, Data, Rabal, Serova	Prak, William T. Riker, Jean-Luc Picard, Spot
tng7x10	Inheritance	Data encounters a woman claiming to be his "mother".  	Robert Scheerer	Dan Koeppel	1993-11-22	tng	7	10	Data	Juliana Tainer	Jean-Luc Picard, Geordi La Forge, Pran Tainer, Noonian Soong
tng7x11	Parallels	Worf finds himself randomly shifting between alternate realities.  	Robert Wiemer	Brannon Braga	1993-11-29	tng	7	11	Worf		Deanna Troi, Beverly Crusher, Geordi La Forge, William T. Riker, Jean-Luc Picard, Data
tng7x12	The Pegasus	Riker 's former Captain boards the Enterprise to retrieve the USS Pegasus . Picard investigates the circumstances of its loss and finds that there has been a cover-up . Features Terry O'Quinn as Admiral Eric Pressman.  	LeVar Burton	Ronald D. Moore	1994-01-10	tng	7	12	William T. Riker	Jean-Luc Picard, Erik Pressman	Sirol
tng7x13	Homeward	Worf 's human foster brother violates the Prime Directive to save a doomed primitive race.  	Alexander Singer	Spike Steingasser Based on material by William N. Stape	1994-01-17	tng	7	13	Nikolai Rozhenko	Worf	Jean-Luc Picard, Data, Beverly Crusher, Geordi La Forge, Vorin, Dobara
tng7x14	Sub Rosa	Dr. Crusher attends her grandmother's funeral, and takes on an unusual family tradition.  	Jonathan Frakes	Jeri Taylor Based on material by Jeanna F. Gallo	1994-01-31	tng	7	14	Beverly Crusher	Ronin	Ned Quint, Jean-Luc Picard, Deanna Troi, Maturin, Geordi La Forge, Data
tng7x15	Lower Decks	Junior officers buck for promotion as one of them is assigned the dangerous task of helping a Cardassian spy.  	Gabrielle Beaumont	Ron Wilkerson  and  Jean Louise Matthias	1994-02-07	tng	7	15		William T. Riker, Sito Jaxa, Sam Lavelle	Deanna Troi, Jean-Luc Picard, Alyssa Ogawa, Taurik, Ben, Worf, Joret Dal
tng7x16	Thine Own Self	Data loses his memory after retrieving radioactive fragments on a planet's surface and endangers the humanoid settlement he encounters, while Deanna studies to become a bridge officer.  	Winrich Kolbe	Christopher Hatton	1994-02-14	tng	7	16	Data	Deanna Troi	William T. Riker, Gia, Garvin, Talur, Skoran
tng7x17	Masks	The Enterprise finds an ancient library that recreates its civilization by taking possession of Data and transforming the ship.  	Robert Wiemer	Joe Menosky	1994-02-21	tng	7	17		Data, Ihat], Jean-Luc Picard	Beverly Crusher, Worf, Deanna Troi, Geordi La Forge, William T. Riker
tng7x18	Eye of the Beholder	Deanna investigates the suicide of a crewman and uncovers a murder that took place during construction of the Enterprise .  	Cliff Bole	Brannon Braga	1994-02-28	tng	7	18	Deanna Troi	Worf	Jean-Luc Picard, William T. Riker, Daniel Kwon, Maddy Calloway, Walter Pierce, Nara, Marla Finn
tng7x19	Genesis	A routine medical treatment inadvertently creates a virus that begins to de-evolve the Enterprise crew while Picard and Data are on an away mission. This is the first and only episode to be directed by Gates McFadden, who plays Dr. Crusher.  	Gates McFadden	Brannon Braga	1994-03-21	tng	7	19		Jean-Luc Picard, Data	Beverly Crusher, Worf, Deanna Troi, William T. Riker, Alyssa Ogawa, Reginald Barclay
tng7x20	Journey's End	Wesley considers his future, as the Enterprise is ordered to remove Native American colonists from a planet that is about to fall under Cardassian jurisdiction. Guest star Richard Poe as Gul Evek. Final appearance of Eric Menyuk as The Traveler.  	Corey Allen	Shawn Piller and Antonia Napoli	1994-03-28	tng	7	20	Wesley Crusher, Jean-Luc Picard	Anthwara, The Traveler	Evek, Alynna Nechayev, Beverly Crusher, Geordi La Forge, Worf
tng7x21	Firstborn	Worf attempts to convince his son Alexander to embrace his warrior heritage. Guest star James Sloyan as K'mtar.  	Jonathan West	Mark Kalbfeld	1994-04-25	tng	7	21	Alexander Rozhenko	Worf	William T. Riker, Deanna Troi, Lursa, B'Etor
tng7x22	Bloodlines	DaiMon Bok returns to exact revenge on Picard , by trying to kill the son Picard never knew he had. Guest star Lee Arenberg as DaiMon Bok.  	Les Landau	Nicholas Sagan	1994-05-02	tng	7	22	Jean-Luc Picard	Bok, Jason Vigo	Beverly Crusher, Data, Geordi La Forge, Miranda Vigo, Birta
tng7x23	Emergence	The Enterprise becomes an emergent intelligence.  	Cliff Bole	Brannon Braga	1994-05-09	tng	7	23		Jean-Luc Picard, Data	Beverly Crusher, William T. Riker, Worf, Geordi La Forge, Deanna Troi, train conductor
tng7x24	Preemptive Strike	Lieutenant Ro graduates from advanced tactical training, and is sent by Picard to lure Maquis terrorists into a trap. Guest star Richard Poe as Gul Evek.  	Patrick Stewart	Naren Shankar	1994-05-16	tng	7	24	Ro Laren	Jean-Luc Picard, Macius	Data, Santos, Kalita
tng7x25	All Good Things...	Picard finds himself being transported between three time periods thanks to Q , with a spacetime distortion that threatens to destroy reality growing larger in the past, and smaller in the future.  	Winrich Kolbe	Ronald D. Moore  and  Brannon Braga	1994-05-23	tng	7	25	Jean-Luc Picard	Q	William T. Riker, Beverly Crusher, Worf, Deanna Troi, Geordi La Forge, Data, Natasha Yar, Miles O'Brien
tng7x26	All Good Things...	Picard finds himself being transported between three time periods thanks to Q , with a spacetime distortion that threatens to destroy reality growing larger in the past, and smaller in the future.  	Winrich Kolbe	Ronald D. Moore  and  Brannon Braga	1994-05-23	tng	7	26			
voy1x01	Caretaker	While searching for a missing Maquis ship with a Starfleet spy aboard, USS Voyager is swept away to the Delta Quadrant, more than 70,000 light-years from home, by an incredibly powerful being known as the "Caretaker."  	Winrich Kolbe	Rick Berman, Michael Piller and Jeri Taylor	1995-01-16	voy	1	1		Chakotay, Kathryn Janeway, Tom Paris	The Doctor, Harry Kim, Tuvok, B'Elanna Torres, Neelix, Kes
voy1x02	Caretaker	While searching for a missing Maquis ship with a Starfleet spy aboard, USS Voyager is swept away to the Delta Quadrant, more than 70,000 light-years from home, by an incredibly powerful being known as the "Caretaker."  	Winrich Kolbe	Rick Berman, Michael Piller and Jeri Taylor	1995-01-16	voy	1	2			
voy1x03	Parallax	Voyager is trapped in a quantum singularity's event horizon, and Captain Janeway must decide between Lt. Carey and former Maquis B'Elanna Torres to be the new chief engineer.  	Kim Friedman	Jim Trombetta	1995-01-23	voy	1	3	B'Elanna Torres	Kathryn Janeway, Chakotay	Carey, Kes, The Doctor, Tom Paris, Neelix, Harry Kim, Tuvok
voy1x04	Time and Again	Investigating a planet just devastated by a polaric explosion, Janeway and Paris are engulfed by a subspace fracture and transported in time to before the accident.  	Les Landau	David Kemper	1995-01-30	voy	1	4		Tom Paris, Kathryn Janeway	Chakotay, Kes, Tuvok, Neelix, B'Elanna Torres, Harry Kim, The Doctor, Pe'Nar Makull, Ny Terla, Lakita
voy1x05	Phage	An organ-harvesting species known as the Vidiians steal Neelix's lungs, leaving him to die.  	Winrich Kolbe	Timothy DeHaas	1995-02-06	voy	1	5	Neelix	Kes	The Doctor, Kathryn Janeway, B'Elanna Torres, Chakotay, Harry Kim, Tom Paris, Tuvok
voy1x06	The Cloud	The crew enter a nebula to collect samples before realizing it is a living organism, but not before doing it injury.  	David Livingston	Brannon Braga	1995-02-13	voy	1	6	Kathryn Janeway	Chakotay, Tom Paris, Harry Kim	Neelix, B'Elanna Torres, The Doctor, Tuvok, Kes, Gaunt Gary
voy1x07	Eye of the Needle	A micro-wormhole is discovered that leads to the Alpha Quadrant, and the crew make contact with a Romulan ship on the other side.  	Winrich Kolbe	Hilary J. Bader	1995-02-20	voy	1	7		Kathryn Janeway, The Doctor	Tom Paris, Harry Kim, Chakotay, Kes, B'Elanna Torres, Tuvok, Telek R'Mor
voy1x08	Ex Post Facto	Tom Paris is convicted of murder on an alien world, and his punishment is to witness the murder from the victim's perspective every 14 hours.  	LeVar Burton	Evan Carlos Somers	1995-02-27	voy	1	8	Tom Paris	Tuvok, Kathryn Janeway	The Doctor, Kes, Chakotay, Neelix, Harry Kim, B'Elanna Torres
voy1x09	Emanations	Harry Kim is transported to an alien world at the same time as a dead woman's body arrives on Voyager.  	David Livingston	Brannon Braga	1995-03-13	voy	1	9	Harry Kim	Kathryn Janeway, Ptera	Chakotay, B'Elanna Torres, Tuvok, Neria, Hatil Garan, Seska, Loria, The Doctor, Kes
voy1x10	Prime Factors	A race that could shorten Voyager's journey with a transportation device will not share its technology.  	Les Landau	David R. George III and Eric A. Stillwell	1995-03-20	voy	1	10	Kathryn Janeway	Gathorel Labin	Tuvok, B'Elanna Torres, Harry Kim, Tom Paris, Chakotay, Neelix, Kes, Jaret Otel, Eudana, Joe Carey
voy1x11	State of Flux	Janeway and the other senior officers attempt to flush out a spy who is sending information to the Kazon.  	Robert Scheerer	Paul Robert Coyle	1995-04-10	voy	1	11	Seska	Chakotay	Kathryn Janeway, Harry Kim, Tom Paris, Neelix, Joe Carey, Tuvok, B'Elanna Torres, The Doctor, Kes, Culluh
voy1x12	Heroes and Demons	The holographic doctor must rescue crew members who were turned to light energy in a Holodeck simulation of Beowulf.  	Les Landau	Naren Shankar	1995-04-24	voy	1	12	The Doctor	Kathryn Janeway	B'Elanna Torres, Tuvok, Chakotay, Tom Paris, Harry Kim, Kes, Unferth, Hrothgar, Freya
voy1x13	Cathexis	A shuttlecraft with Chakotay and Tuvok aboard is attacked; Chakotay is left brain-dead, while Tuvok begins acting strangely. An unknown force begins controlling crewmembers.  	Kim Friedman	Brannon Braga and Joe Menosky	1995-05-01	voy	1	13		Kathryn Janeway, Tuvok	The Doctor, Harry Kim, Kes, B'Elanna Torres, Tom Paris, Neelix, Chkotay, The Doctor
voy1x14	Faces	B'Elanna Torres is split into her human and Klingon halves by the Vidiians.  	Winrich Kolbe	Jonathan Glassner and Kenneth Biller	1995-05-08	voy	1	14	B'Elanna Torres	Tom Paris, Sulan	Chakotay, Neelix, Kathryn Janeway, Tuvok, Harry Kim, Peter Durst, The Doctor, Kes
voy1x15	Jetrel	A member of the Haakonians, a race warring with the Talaxians, arrives on Voyager, much to the dismay of Neelix, whose family was killed by a weapon of mass destruction this particular individual devised.  	Kim Friedman	James Thomton and Scott Nimerfro	1995-05-15	voy	1	15	Neelix	Kathryn Janeway, Jetrel	Tuvok, Tom Paris, Harry Kim, Chakotay, Gaunt Gary, The Doctor, Kes, B'Elanna Torres
voy1x16	Learning Curve	Tuvok trains several Maquis members who have not fully integrated into the Voyager crew.  	David Livingston	Ronald Wilkerson and Jean Louise Matthias	1995-05-22	voy	1	16	Tuvok	Kenneth Dalby, Kathryn Janeway	Chakotay, B'Elanna Torres, Kes, The Doctor, Harry Kim, Neelix, Tom Paris, Chell, Gerron, Mariah Henley
