StoryID	Title	Summary	Director	Writer	AirDate	SeriesID	Season	Episode	ObjectCharacters	MainCharacters	MinorCharacters
voy2x01	The 37s	A group of humans from the 1930s are found in stasis on a seemingly abandoned planet, including the lost Amelia Earhart.  	James L. Conway	Jeri Taylor and Brannon Braga	1995-08-28	voy	2	1		Kathryn Janeway, Amelia Earhart	Harry Kim, Tuvok, Tom Paris, B'Elanna Torres, Chakotay, Nogami, John Evansville, Fred Noonan, The Doctor, Jack Hayes, Neelix
voy2x02	Initiations	Chakotay encounters a Kazon youth who is on an initiation rite: to earn his name by killing an enemy or be killed in the attempt.  	Winrich Kolbe	Kenneth Biller	1995-09-04	voy	2	2	Chakotay	Kathryn Janeway, Kar	Razik, Haliz, Ayala, Culhane, Neelix, Tukov, Tom Paris, Harry Kim, B'Elanna Torres, The Doctor, Kes
voy2x03	Projections	The Doctor becomes delusional after an accident, causing him to believe that he is a flesh-and-blood person and his time on USS Voyager is a holodeck program.  	Jonathan Frakes	Brannon Braga	1995-09-11	voy	2	3	The Doctor	Reginald Barclay	B'Elanna Torres, Neelix, Kathryn Janeway, Harry Kim, Tom Paris, Chakotay, Kes, Tuvok
voy2x04	Elogium	Space-dwelling life-forms cause Kes to enter the Ocampan fertile phase called Elogium, putting pressure on her relationship with Neelix when she wants to have his child.  	Winrich Kolbe	Jimmy Diggs and Steve J. Kay	1995-09-18	voy	2	4	Kes, Neelix	Kathryn Janeway, Chakotay	Tom Paris, Harry Kim, Tuvok, Samantha Wildman, B'Elanna Torres, The Doctor
voy2x05	Non Sequitur	Harry Kim wakes up in 24th century San Francisco with no record of him on Voyager.  	David Livingston	Brannon Braga	1995-09-25	voy	2	5	Harry Kim	Libby, Tom Paris	Cosimo, Strickler, Lasca, Kathryn Janeway, B'Elanna Torres, Tuvok, Chakotay
voy2x06	Twisted	A region of space distorts the interior of Voyager.  	Kim Friedman	Arnold Rudnick and Rich Hosek	1995-10-02	voy	2	6		Tuvok, Chakotay, Kathryn Janeway, Tom Paris, Harry Kim, B'Elanna Torres, Kes, The Doctor	Gaunt Gary, Sandrine, Walter Baxter, Neelix
voy2x07	Parturition	Neelix and Tom Paris fight over Kes, but are sent on an away mission together.  	Jonathan Frakes	Tom Szollosi	1995-10-09	voy	2	7	Neelix, Tom, Kes	Kathryn Janeway	Chakotay, B'Elanna Torres, Tuvok, The Doctor, Harry Kim
voy2x08	Persistence of Vision	The crew experiences hallucinations brought on by an alien that put them into a trance-like state.  	James L. Conway	Jeri Taylor	1995-10-30	voy	2	8	Kathryn Janeway	Kes, The Doctor	Chakotay, Tuvok, Tom Paris, Neelix, B'Elanna Torres, Harry Kim, Lord Burleigh, Mrs. Templeton, Mark Hobbes Johnson, Owen Paris, Beatrice Burleigh, Henry Burleigh, Bothan Inflitrator, T'Pel
voy2x09	Tattoo	Chakotay encounters non-humans who have the same tattoo on their foreheads that he has.  	Alexander Singer	Larry Brody	1995-11-06	voy	2	9	Chakotay	Kathryn Janeway, Kolopak, The Doctor	Harry Kim, B'Elanna Torres, Neelix, Tuvok, Samantha Wildman, Sky Spirit Chief, Kes
voy2x10	Cold Fire	An Ocampan helps Kes with her mental abilities as the crew encounter a being who appears to be the Caretaker's female counterpart.  	Cliff Bole	Anthony Williams	1995-11-13	voy	2	10	Kes	Tuvok, Kathryn Janeway, Tanis	Neelix, The Doctor, B'Elanna Torres, Harry Kim, Chakotay, Tom Paris, Suspiria
voy2x11	Maneuvers	Kazon Nistrim board Voyager and steal a transporter module in an attempt to unite the Kazon sects.  	David Livingston	Kenneth Biller	1995-11-20	voy	2	11	Chakotay, Seska	Kathryn Janeway	B'Elanna Torres, Kathryn Janeway, Tuvok, Harry Kim, Tom Paris, Culluh, Haron, Surat, Neelix, The Doctor, Kes
voy2x12	Resistance	A mission to acquire Telerium goes wrong causing Tuvok and B'Elanna to be captured and believed to be with the resistance.  	Winrich Kolbe	Michael Jan Friedman and Kevin J. Ryan	1995-11-27	voy	2	12	Kathryn Janeway	Chakotay, Caylem	Neelix, Tuvok, Harry Kim, Tom Paris, Augris, Darod, Tuvok, B'Elanna Torres
voy2x13	Prototype	The crew finds and reactivates a robot's body which was adrift in space only to find themselves in the middle of a war when B'Elanna is abducted.  	Jonathan Frakes	Nicholas Corea	1996-01-15	voy	2	13	B'Elanna Torres	Automate Unit 3947, Kathryn Janeway	Tuvok, Harry Kim, Neelix, The Doctor, Automated Unit 6263, Chakotay, Tom Paris, Prototype Unit 0001, Automated Commander 122, Kes
voy2x14	Alliances	Janeway attempts to form an alliance with the Kazon to improve Voyager's standing in the Delta Quadrant.  	Les Landau	Jeri Taylor	1996-01-22	voy	2	14	Kathryn Janeway	Chakotay, Mabus	B'Elanna Torres, The Doctor, Harry Kim, Tom Paris, Tuvok, Kes, Cullah, Seska, Michael Jonas, Tersa, Surat, Hogan, Neelix
voy2x15	Threshold	Tom Paris breaks the transwarp threshold in the Shuttlecraft Cochrane, designed to reach warp 10, but there are some peculiar side effects.  	Alexander Singer	Michael De Luca	1996-01-29	voy	2	15	Tom Paris	Kathryn Janeway, The Doctor	B'Elanna Torres, Harry Kim, Neelix, Chakotay, Tuvok, Kes, Rettik, Michael Jonas
voy2x16	Meld	Crewman Lon Suder murders an Engineering crewman for no apparent reason. Tuvok mind melds with him to ascertain his motive.  	Cliff Bole	Mike Sussman	1996-02-05	voy	2	16	Tuvok	Kathryn Janeway, Lon Suter	Kes, The Doctor, Harry Kim, Tom Paris, Ricky, Hogan, B'Elanna Torres, Neelix, Chakotay
voy2x17	Dreadnought	A highly advanced Cardassian AI missile that had been reprogrammed by B'Elanna Torres is found in the Delta Quadrant.  	LeVar Burton	Gary Holland	1996-02-12	voy	2	17	B'Elanna Torres	Tom Paris, Kathryn Janeway, Chakotay	Samantha Wildman, The Doctor, Kes, Harry Kim, Tuvok, Neelix, Michael Jonas, Lorrum, Kellan
voy2x18	Death Wish	The crew encounter a member of the Q Continuum seeking to end his immortal life.  	James L. Conway	Shawn Piller	1996-02-19	voy	2	18	Kathryn Janeway	Q, Quinn, Tuvok	Chakotay, Harry Kim, B'Elanna Torres, Isaac Newton, Maury Ginsberg, Neelix, Kes, Tom Paris, William T. Riker
voy2x19	Lifesigns	The Doctor helps a Phage-ridden Vidiian woman.  	Cliff Bole	Kenneth Biller	1996-02-26	voy	2	19	The Doctor	Tom Paris, Chakotay, Danara Pel	Kathryn Janeway, Harry Kim, Tuvok, Kes, Michael Jonas, Seska, Lorrum, B'Elanna Torres, Neelix
voy2x20	Investigations	Neelix tries to flush out the traitor on board who has been colluding with the Kazon Nistrim.  	Les Landau	Jeff Schnaufer and Ed Bond	1996-03-13	voy	2	20	Neelix, Tom Paris	Michael Jonas, Kathryn Janeway	The Doctor, Harry Kim, Seska, Laxeth, Hogan, Tuvok, B'Elanna Torres, Kes
voy2x21	Deadlock	Attempting to evade the Vidiians, a duplicate Voyager is created after it passes through a spatial scission.  	David Livingston	Brannon Braga	1996-03-18	voy	2	21	Kathryn Janeway	The Doctor, Samantha Wildman	Neelix, Hogan, Kes, Tuvok, Chakotay, Harry Kim, Tom Paris, B'Elanna Torres
voy2x22	Innocence	Tuvok crash-lands on a moon and finds children who have been abandoned.  	James L. Conway	Anthony Williams	1996-04-08	voy	2	22	Tuvok	Alcia, Tressa, Elani, Corin, Kathryn Janeway	Bennet, Chakotay, The Doctor, Kes, Harry Kim, Tom Paris, Neelix, B'Elanna Torres
voy2x23	The Thaw	The crew finds aliens mentally connected to a computer that has created a being that feeds on their fear.  	Marvin V. Rush	Richard Gadas	1996-04-29	voy	2	23		Kathryn Janeway, Harry Kim, The Doctor, The Clown, B'Elanna Torres	Chakotay, Tuvok, Neelix, Kes, Viorsa, The Specter, Little Woman, Tom Paris, B'Elanna Torres
voy2x24	Tuvix	A transporter accident merges Tuvok and Neelix into a new person.  	Cliff Bole	Andrew Shepard Price and Mark Gaberman	1996-05-06	voy	2	24	Tuvix	Kathryn Janeway, Kes	Harry Kim, Hogan, The Doctor, Kes, Chakotay, B'Elanna Torres, Tom Paris, Tuvok, Neelix
voy2x25	Resolutions	Janeway and Chakotay must adapt to life quarantined on a planet after they contract an incurable disease.  	Alexander Singer	Jeri Taylor	1996-05-13	voy	2	25	Kathryn Janeway, Chakotay	Tuvok	Tom Paris, Neelix, B'Elanna Torres, Harry Kim, Danara Pel, Hogan, Swinn, The Doctor, Kes
voy2x26	Basics, Part I	Seska and the Kazon-Nistrim take control of Voyager and maroon its crew on a primitive planet.  	Winrich Kolbe	Michael Piller	1996-05-20	voy	2	26		Kathryn Janeway, Tuvok, Lon Suder, Tierna	Culluh, Seska, Kolopak, Harry Kim, Tom Paris, Chakotay, Neelix, The Doctor, B'Elanna Torres, Kes
voy3x01	Basics, Part II	The crew must learn to survive on the inhospitable planet as the Doctor, Crewman Suder and Paris attempt to regain control of the ship.  	Winrich Kolbe	Michael Piller	1996-09-04	voy	3	1	The Doctor, Lon Suder	Seska, Chakotay	Kathryn Janeway, Neelix, Hogan, Samantha Wildman, Culluh, Tom Paris, Kes, Paxim, Harry Kim, B'Elanna Torres, Tuvok
voy3x02	Flashback	Tuvok experiences brain-damaging flashbacks to his service on the Excelsior. He and the captain attempt to find the reason for the flashbacks, believed to be a suppressed memory, through a joint mindmeld.  	David Livingston	Brannon Braga	1996-09-11	voy	3	2	Tuvok	Kathryn Janeway, The Doctor	Hikaru Sulu, Neelix, Janice Rand, Dimitri Valtane, Lojur, Kang, B'Elanna Torres, Kes, Chakotay, Harry Kim
voy3x03	The Chute	Tom Paris and Harry Kim are trapped in a prison. Tom gets stabbed trying to protect Kim, leaving him to try to find an escape plan alone. Simultaneously, Voyager is trying to find a way to prove their innocence.  	Les Landau	Clayvon C. Harris	1996-09-18	voy	3	3	Harry Kim, Tom Paris	Kathryn Janeway, Zio	Kes, The Doctor, B'Elanna Torres, Tuvok, Chakotay, Neelix, Liria, Vel, Pit, Rib, Piri
voy3x04	The Swarm	Voyager encounters a swarm of ships while trying to take a shortcut through a space belonging to a hostile species, while the Doctor begins to experience memory loss.  	Alexander Singer	Mike Sussman	1996-09-25	voy	3	4	The Doctor	Kes, Kathryn Janeway, B'Elanna Torres	Tom Paris, Harry Kim, Tuvok, Chakotay, Neelix, Giuseppina Pentangeli, Lewis Zimmerman, Chardis
voy3x05	False Profits	The crew encounters the Delta Quadrant terminus of the Barzan wormhole...and the two Ferengi from "The Price" now posing as gods on a nearby planet.  	Cliff Bole	George Brozak	1996-10-02	voy	3	5		Kathryn Janeway, Arridor, Kol, Neelix, Chakotay, Tom Paris	B'Elanna Torres, Harry Kim, Tuvok, the bard, Kafar, the sandal maker, the merchant
voy3x06	Remember	B'Elanna experiences vivid dreams.  	Winrich Kolbe	Brannon Braga and Joe Menosky	1996-10-09	voy	3	6	B'Elanna Torres	Kathryn Janeway	The Doctor, Kes, Tuvok, Chakotay, Harry Kim, Tom Paris, Neelix, Jor Brel, Jessen, Korenna Mirell, Jareth, Dathan Alaris
voy3x07	Sacred Ground	Kes is left comatose after contacting an energy field around a rock.  	Robert Duncan McNeill	Geo Cameron	1996-10-30	voy	3	7	Kathryn Janeway	Kes, The Doctor, Neelix, Guide	Harry Kim, B'Elanna Torres, The Magistrate, Chakotay, Tuvok
voy3x08	Future's End, Part I	A 29th century timeship causes a time paradox when it accidentally sends itself and Voyager to two different periods in 20th century Earth.  	David Livingston	Brannon Braga and Joe Menosky	1996-11-06	voy	3	8		Kathryn Janeway, Tom Paris, Henry Starling, Tuvok, Chakotay, Rain Robinson	B'Elanna Torres, Harry Kim, Braxton, Neelix, Kes, Dunbar, The Doctor
voy3x09	Future's End, Part II	Janeway must prevent the destruction of the solar system by a 20th century entrepreneur who has acquired the timeship.  	Cliff Bole	Brannon Braga and Joe Menosky	1996-11-13	voy	3	9		B'Elanna Torres, Kathryn Janeway, Chakotay, Tuvok, Tom Paris, Henry Starlin, Rain Robinson	Harry Kim, B'Elanna Torres, Neelix, Kes, The Doctor, Dunbar, Butch, Porter, Braxton
voy3x10	Warlord	Kes is controlled by an alien warlord named Tieran.  	David Livingston	Andrew Shepard Price and Mark Gaberman	1996-11-20	voy	3	10	Kes	Kathryn Janeway, Neelix, Tuvok, Demmas	Harry Kim, Tom Paris, B'Elanna Torres, Chakotay, The Doctor, Tieran, Adin, Nori, Resh, Ameron
voy3x11	The Q and the Grey	Q visits Voyager with a proposal for Janeway as civil war breaks out in the Q Continuum.  	Cliff Bole	Shawn Piller	1996-11-27	voy	3	11	Kathryn Janeway, Q	Chakotay, Female Q	Tuvok, Neelix, Harry Kim, The Doctor, Kes, Tom Paris, Chakotay, B'Elanna Torres, Colonel Q
voy3x12	Macrocosm	Voyager answers help from a mining colony about a viral outbreak that manages to sneak onto Voyager through the transporter, leaving only Janeway and the Doctor to stop it.  	Alexander Singer	Brannon Braga	1996-12-11	voy	3	12	Kathryn Janeway	Neelix, The Doctor	B'Elanna Torres, Tom Paris, Harry Kim, Chakotay, Kes, Tak Tak consul, Garan miner
voy3x13	Fair Trade	Voyager approaches the edge of Neelix's knowledge and a trading station.  	Jesús Salvador Treviño	Ronald Wilkerson and Jean Louise Matthias	1997-01-08	voy	3	13	Neelix	Kathryn Janeway,  Wixiban	Tom Paris, Chakotay, B'Elanna Torres, The Doctor, Kes, Bahrat, Vorik, Sutok, Tosin, map dealer
voy3x14	Alter Ego	The crew enjoys a luau on the holodeck and Tuvok discovers an unusual hologram.  	Robert Picardo	Joe Menosky	1997-01-15	voy	3	14	Tuvok	Harry Kim, Kathryn Janeway, Maryana	The Doctor, B'Elanna Torres, Tom Paris, Chakotay, Vorik, Neelix, Kes
voy3x15	Coda	Janeway appears to be trapped in a time-loop with different events, but all ending in her death.  	Nancy Malone	Jeri Taylor	1997-01-29	voy	3	15	Kathryn Janeway	Chakotay, Admiral Janeway	Neelix, Tuvok, Tom Paris, B'Elanna Torres, The Doctor, Kes, Harry Kim
voy3x16	Blood Fever	Vorik passes on the Pon farr to B'Elanna.  	Andrew Robinson	Lisa Klink	1997-02-05	voy	3	16	Vorik, B'Elanna Torres	Tuvok, Tom Paris	Tuvok, Kes, Chakotay, Ishan, The Doctor, Kathryn Janeway
voy3x17	Unity	Chakotay answers a call for help on a planet and finds himself in the middle of a shoot-out between two groups of people. Meanwhile, the Voyager crew discovers an abandoned Borg ship.  	Robert Duncan McNeill	Kenneth Biller	1997-02-12	voy	3	17	Chakotay	Kathryn Janeway, Riley Frazier	The Doctor, Kes, B'Elanna Torres, Harry Kim, Tom Paris, Tuvok, Neelix, Marie Kaplan, Orum
voy3x18	Darkling	The Doctor tries to graft other personalities into his program, but the resulting 'upgrade' causes him to develop an evil alternate personality.  	Alexander Singer	Brannon Braga and Joe Menosky	1997-02-19	voy	3	18	The Doctor, Kes	Kathryn Janeway	Ghandi, Lord Byron, Neelix, Tuvok, Tom Paris, Chakotay, Zahir, Nakahn, Harry Kim
voy3x19	Rise	Voyager helps a planet with asteroid problems. Tuvok and Neelix crash-land on the planet and attempt to fix a maglev space elevator.  	Robert Scheerer	Jimmy Diggs	1997-02-26	voy	3	19		Tuvok, Neelix, Lilias, Sklar, Hanjuan	Tom Paris, Nezu ambassador, Chakotay, Harry Kim, Goth, Kes, The Doctor, B'Elanna Torres, Kathryn Janeway, Vatm
voy3x20	Favorite Son	Harry Kim is drawn to a planet that is nearly all women.  	Marvin V. Rush	Lisa Klink	1997-03-19	voy	3	20	Harry	Kathryn Janeway, Lyris	Tuvok, Alben, B'Elanna Torres, Kes, The Doctor, Tom Paris, Eliann, Taymon, Rinna, Malia, Chakotay
voy3x21	Before and After	Shortly before her death in the future, Kes begins to travel backwards in time, with a portion of events occurring in the Year of Hell.  	Allan Kroeker	Kenneth Biller	1997-04-09	voy	3	21	Kes	The Doctor, Tom Paris	Chakotay, Linnis Paris, Benaren, Harry Kim, Neelix, Tuvok, Andrew Kim, B'Elanna Torres, Kathryn Janeway
voy3x22	Real Life	The Doctor creates a family on the holodeck.  	Anson Williams	Harry 'Doc' Kloor	1997-04-23	voy	3	22	[object]	The Doctor Kenneth, Tom Paris, Charlene, Jeffrey, Belle	B'Elanna Torres, Kes, Larg, K'Kath, Chakotay, Harry Kim, Tuvok, Neelix, Kathryn Janeway
voy3x23	Distant Origin	A reptilian scientist trying to prove his heretical theories kidnaps Chakotay and draws the entire crew in conflict between his race's doctrine and the startling truth about its origin.  	David Livingston	Brannon Braga and Joe Menosky	1997-04-30	voy	3	23	Forra Gegen	Chakotay, Kathryn Janeway, Tova Veer	Haluk, Odala, Tom Paris, B'Elanna Torres, Tuvok, Harry Kim, Neelix, The Doctor, Kes
voy3x24	Displaced	Crew members are replaced one-by-one with aliens from an unknown race.  	Allan Kroeker	Lisa Klink	1997-05-07	voy	3	24		Tom Paris, B'Elanna Torres, Kathryn Janeway	Tuvok, Harry Kim, Jarlath, Rislan, Taleen, Ensign Lang, Neelix, Kes, Dammar, Chakotay
voy3x25	Worst Case Scenario	B'Elanna Torres discovers a holodeck program where Chakotay and the Maquis rebel against Janeway.  	Alexander Singer	Kenneth Biller	1997-05-14	voy	3	25		Seska, Chakotay, Tom Paris, B'Elanna Torres	Kes, Neelix, Kathryn Janeway, Harry Kim, The Doctor
voy3x26	Scorpion, Part I	Voyager must pass through Borg space, only to discover a new alien race that is even deadlier than the Borg.  	David Livingston	Brannon Braga and Joe Menosky	1997-05-21	voy	3	26		Kathryn Janeway, Kes	Tom Paris, Chakotay, B'Elanna Torres, The Doctor, Harry Kim, Tuvok, Neelix, Leonardo da Vinci
voy4x01	Scorpion, Part II	Janeway and Tuvok work with the Borg and meet Seven of Nine as they collaborate on developing a weapon against Species 8472 in exchange for safe passage through Borg space.  	Winrich Kolbe	Brannon Braga and Joe Menosky	1997-09-03	voy	4	1		Kathryn Janeway, Chakotay, Seven of Nine	Tom Paris, Kes, B'Elanna Torres, The Doctor, Harry Kim, Neelix, Tuvok
voy4x02	The Gift	Kes' mental abilities develop to a point where they endanger Voyager.  	Anson Williams	Joe Menosky	1997-09-10	voy	4	2	Seven of Nine, Kes	Kathryn Janeway, The Doctor	Chakotay, Tuvok, Neelix, Tom Paris, Harry Kim, B'Elanna Torres
voy4x03	Day of Honor	B'Elanna tries to observe the Klingon Day of Honor after the warp core is lost.  	Jesús Salvador Treviño	Jeri Taylor	1997-09-17	voy	4	3	B'Elanna Torres	Tom Paris, Seven of Nine	Kathryn Janeway, Vorik, Chakotay, Tuvok, Rahmin, Neelix, Lumas, Moklor, Harry Kim
voy4x04	Nemesis	Chakotay helps fight in an alien war.  	Alexander Singer	Kenneth Biller	1997-09-24	voy	4	4	Chakotay	Tuvok, Brone	Namon, Kradin Commandant, Penno, Marna, Kathryn Janeway, Tom Paris, B'Elanna Torres, Harry Kim, Neelix, Rafin, The Doctor, Ambassador Treen
voy4x05	Revulsion	A hologram contacts Voyager and the Doctor is excited to meet another hologram.  	Kenneth Biller	Lisa Klink	1997-10-01	voy	4	5		The Doctor, B'Elanna Torres, Harry Kim, Seven of Nine, Dejaren	Tom Paris, Tuvok, Neelix, Kathryn Janeway, Chakotay
voy4x06	The Raven	Seven of Nine experiences Borg flashbacks as she attempts to become more human.  	LeVar Burton	Bryan Fuller	1997-10-08	voy	4	6	Seven of Nine	Tuvok, Kathryn Janeway	The Doctor, Chakotay, Gaumen, Dumah, Tom Paris, Neelix, Harry Kim, B'Elanna Torres
voy4x07	Scientific Method	The crew have unexplained illnesses as they are closely observed by unseen intruders.  	David Livingston	Sherry Klein and Harry 'Doc' Kloor	1997-10-29	voy	4	7		The Doctor, Seven of Nine, Kathryn Janeway, Tuvok	Tom Paris, B'Elanna Torres, Chakotay, Harry Kim, Neelix
voy4x08	Year of Hell, Part I	Voyager creates a new Astrometrics lab, which maps a new course that brings them into contact with a Krenim temporal ship that can erase things from history.  	Allan Kroeker	Brannon Braga and Joe Menosky	1997-11-05	voy	4	8		Kathryn Janeway, The Doctor	Seven of Nine, Tuvok, Harry Kim, Tom Paris, Chakotay, Neelix, B'Elanna Torres, Obrist, Annorax
voy4x09	Year of Hell, Part II	A badly damaged Voyager hides in a nebula as a skeleton crew attempts repairs; meanwhile the Krenim commander proposes a compromise to Chakotay and Tom Paris.  	Mike Vejar	Brannon Braga and Joe Menosky	1997-11-12	voy	4	9		Kathryn Janeway, Chakotay, Tom Paris, Annorax	B'Elanna Torres, The Doctor, Seven of Nine, Tuvok, Obrist, Neelix, Harry Kim
voy4x10	Random Thoughts	Torres is arrested while visiting a world of telepaths where violent thoughts are a crime.  	Alexander Singer	Kenneth Biller	1997-11-19	voy	4	10		B'Elanna Torres, Kathryn Janeway, Tuvok, Nimira	Neelix, Tom Paris, Guill, Talli, Frane, The Doctor, Harry Kim, Chakotay, Seven of Nine
voy4x11	Concerning Flight	Aliens steal several key components of Voyager, which are retrieved with assistance from a holographic Leonardo da Vinci.  	Jesús Salvador Treviño	Jimmy Diggs and Joe Menosky	1997-11-26	voy	4	11	Leonardo da Vinci	Kathryn Janeway, Tuvok, Tau	Chakotay, B'Elanna Torres, Harry Kim, Tom Paris, The Doctor, Seven of Nine, Neelix
voy4x12	Mortal Coil	Neelix dies in an attempt to sample proto-matter from a nebula. Seven of Nine helps resuscitate him using Borg nanoprobes, but Neelix, having no memory of an afterlife of any kind, experiences a spiritual crisis.  	Allan Kroeker	Bryan Fuller	1997-12-17	voy	4	12	Neelix	Seven of Nine, Chakotay	Kathryn Janeway, Tom Paris, Samantha Wildman, Naomi Wildman, Harry Kim, Tuvok, The Doctor, B'Elanna Torres, Alixia
voy4x13	Waking Moments	The crew becomes trapped in a shared nightmare generated by alien technology. Only Chakotay, through his Native American spiritual capabilities, can save them.  	Alexander Singer	André Bormanis	1998-01-14	voy	4	13	Chakotay	The Doctor, Kathryn Janeway, dream species alien	Harry Kim, Seven of Nine, Tuvok, Tom Paris, Neelix, B'Elanna Torres
voy4x14	Message in a Bottle	The Doctor's program is sent to an advanced Starfleet vessel via a vast ancient communications network, but he soon discovers that only he and the ship's own EMH remain to fight against Romulans who have taken over the ship and are attempting to return to Romulan space with it.  	Nancy Malone	Rick Williams	1998-01-21	voy	4	14	The Doctor	EMH Mark II, Kathryn Janeway	Chakotay, B'Elanna Torres, Seven of Nine, Harry Kim, Rekar, Nevala, Tom Paris, Tuvok, Neelix
voy4x15	Hunters	A transmission from Starfleet Command gets held at a Hirogen relay station and Janeway sets course to retrieve it.  	David Livingston	Jeri Taylor	1998-02-11	voy	4	15		Harry Kim, Kathryn Janeway	Chakotay, Tom Paris, B'Elanna Torres, Tuvok, Seven of Nine, The Doctor, Neelix
voy4x16	Prey	Voyager rescues a Hirogen survivor who tells them a new kind of prey is on the loose.  	Allan Eastman	Brannon Braga	1998-02-18	voy	4	16		Seven of Nine, Kathryn Janeway, Alpha-Hirogen, Chakotay	Beta-Hirogen, Tuvok, Tom Paris, Harry Kim, The Doctor, B'Elanna Torres, Neelix
voy4x17	Retrospect	After experiencing unsettling hallucinations, Seven of Nine is hypnotized by the Doctor whose analysis reveals a trader might have extracted Borg technology from Seven without her consent.  	Jesús Salvador Treviño	Andrew Shepard Price and Mark Gaberman	1998-02-25	voy	4	17	Seven of Nine	Kathryn Janeway, Kovin, The Doctor	Tuvok, Chakotay, Tom Paris, B'Elanna Torres, Entharan Magistrate, Harry Kim
voy4x18	The Killing Game	The Hirogen implant devices into the crew making them believe they are characters within the holodecks being used for hunts, all set in World War II Europe.  	David Livingston	Brannon Braga and Joe Menosky	1998-03-04	voy	4	18		Kathryn Janeway, Karr, Seven of Nine	Tuvok, Neelix, B'Elanna Torres, Turanj, the Kapitan, The Doctor, Harry Kim, Chakotay, Tom Paris
voy4x19	The Killing Game	The Hirogen implant devices into the crew making them believe they are characters within the holodecks being used for hunts, all set in World War II Europe.  	David Livingston	Brannon Braga and Joe Menosky	1998-03-04	voy	4	19		Kathryn Janeway, Seven of Nine, Chakotay, Karr	Harry Kim, Turanj, Tom Paris, Tuvok, B'Elanna Torres, Neelix, The Doctor, the Kapitan
voy4x20	Vis à Vis	An alien shuttle with a prototype propulsion system suddenly appears and requires assistance. Paris is restless and volunteers to help the pilot, Steth, repair the shuttle.  	Jesús Salvador Treviño	Robert J. Doherty	1998-04-08	voy	4	20	Tom Paris	Kathryn Janeway, Steth	The Doctor, Chakotay, Harry Kim, Tuvok, Daelan, B'Elanna Torres, Neelix, Seven of Nine
voy4x21	The Omega Directive	Janeway undertakes the Omega Directive, an order to destroy Omega molecules, even if it means violating the Prime Directive.  	Victor Lobl	Jimmy Diggs and Steve J. Kay	1998-04-15	voy	4	21		Kathryn Janeway, Seven of Nine, Chakotay	Harry Kim, Tuvok, Tom Paris, B'Elanna Torres, The Doctor, Allos, Neelix
voy4x22	Unforgettable	An alien female from a cloaked ship asks for Chakotay by name and requests asylum on Voyager from her people.  	Andrew Robinson	Greg Elliot and Michael Perricone	1998-04-22	voy	4	22	Chakotay	Kathryn Janeway, Kellin	Harry Kim, Tom Paris, Tuvok, Seven of Nine, The Doctor, Neelix, Reskat
voy4x23	Living Witness	A Kyrian museum curator 700 years in the future hopes a Voyager relic containing a copy of the Doctor can confirm their version of history.  	Tim Russ	Brannon Braga	1998-04-29	voy	4	23	The Doctor	Kathryn Janeway, Quarren	Neelix, Tom Paris, Harry Kim, Chakotay, Daleth, Tuvok, Seven of Nine, Tedran, B'Elanna Torres
voy4x24	Demon	Tom Paris and Harry Kim take a shuttle down to an extremely inhospitable planet to obtain fuel.  	Anson Williams	André Bormanis	1998-05-06	voy	4	24	Harry Kim, Tom Paris	Kathryn Janeway,  Chakotay	B'Elanna Torres, Tuvok, Neelix, Seven of Nine, The Doctor, Vorik
voy4x25	One	Seven of Nine is left alone on Voyager when a nebula's deadly radiation forces the rest of the crew to stay in stasis and the Doctor's hologram projectors are disrupted.  	Kenneth Biller	Jeri Taylor	1998-05-13	voy	4	25	seven of Nine	Kathryn Janeway, The Doctor	Harry Kim, B'Elanna Torres, Tuvok, Tom Paris, Chakotay, Neelix, Trajis Lo-Tarik
voy4x26	Hope and Fear	Paris and Neelix return from a mission with a passenger named Arturis who knows more than 4,000 languages. He manages to decode a message from Starfleet that could lead to a way home.  	Winrich Kolbe	Rick Berman, Brannon Braga and Joe Menosky	1998-05-20	voy	4	26	Kathryn Janeway, Seven of Nine	Arturis	Chakotay, B'Elannna, Tom Paris, Neelix, Tuvok, Harry Kim, The Doctor
voy5x01	Night	Voyager loses power traversing a dark region of space containing theta radiation.  	David Livingston	Brannon Braga and Joe Menosky	1998-10-14	voy	5	1		Kathryn Janeway, Chakotay	Harry Kim, Tom Paris, The Doctor, Chakotay, Seven of Nine, Tuvok, B'Elanna Torres, Neelix, Doctor Chaotica, Emck
