StoryID	SeriesID	Title	Theme	ThemeLevel	ThemeID	Comment	RelatedCharacters	CharacterClass	RelatedAliens	RelatedThings
tng2x10	tng	The Dauphin	tidally locked planet	peripheral	968	Salia's home planet				Daled IV
tng2x10	tng	The Dauphin	virtual reality room	peripheral	135	Wesley and Salia go on a holo-date				holodeck
tng2x10	tng	The Dauphin	guardian and child	peripheral	537	Anya/Salia	Anya/Salia	dyad		
tng2x10	tng	The Dauphin	loneliness	peripheral	197	Salia	Salia	individual		
tng2x10	tng	The Dauphin	rivalry	peripheral	276	Worf and Guardian	Worf/Anya	dyad		
tng2x10	tng	The Dauphin	lesson in humility	peripheral	153	Worf	Worf	individual		
tng2x10	tng	The Dauphin	man vs. beast	peripheral	353	Worf vs. Anya	Worf	individual		
tng2x10	tng	The Dauphin	anger	peripheral	86	Anya at crew	Anya	individual		
tng2x10	tng	The Dauphin	chastity	peripheral	175	Wesley and Salia	Wesley Crusher, Salia	individual		
tng2x10	tng	The Dauphin	diligence	peripheral	89	Anya at protecting Salia	Anya	individual		
tng2x10	tng	The Dauphin	interest	peripheral	95	Salia in other cultures	Salia	individual		
tng2x10	tng	The Dauphin	temperance	peripheral	239	Salia in her lifestyle	Salia	individual		
tng2x10	tng	The Dauphin	vigilance	peripheral	71	Anya in protecting Salia	Anya	individual		
tng2x10	tng	The Dauphin	wrath	peripheral	56	Anya at Worf	Anya	individual		
tng2x11	tng	Contagion	take-you-anywhere gateway	central	934	Iconian gateways to other parts of the galaxy				
tng2x11	tng	Contagion	arms race	central	403	Romulans wanted to use the gateway for war, but Picard destroyed them on behalf of the Federation				
tng2x11	tng	Contagion	exceedingly devious alien	central	226	Romulan			Romulan	
tng2x11	tng	Contagion	mysterious maker alien race	central	207	Iconians			Iconian	
tng2x11	tng	Contagion	man vs. machine	central	195	Enterprise crew vs. malfunctioning ship computer				
tng2x11	tng	Contagion	risk taking vs. playing it safe	peripheral	157	entering the neutral zone for a story				
tng2x11	tng	Contagion	machines in society	peripheral	261	all the talk about not trusting the ship and using old fashioned tech				
tng2x11	tng	Contagion	coping with the death of a fellow compatriot	peripheral	517	the entire Yamato crew perished				
tng2x11	tng	Contagion	the winners write history	peripheral	965	the Iconians were vilified by historians				
tng2x11	tng	Contagion	attack from outer space by a genocidal enemy	peripheral	595	space computer virus				
tng2x11	tng	Contagion	desperation	peripheral	102	Varley to save his ship	Donald Varley	individual		
tng2x11	tng	Contagion	selfless service	peripheral	186	Picard at end	Jean-Luc Picard	individual		
tng2x11	tng	Contagion	future point of view	peripheral	215	Pulaski about using splints	Katherine Pulaski	individual		
tng2x11	tng	Contagion	pictographic writing system	peripheral	1291	deciphering Iconian script				
tng2x11	tng	Contagion	passion for archaeology	peripheral	387	Picard and Donald Varley	Jean-Luc Picard, Donald Varley	individual		
tng2x11	tng	Contagion	generosity	peripheral	192	Picard helps Romulans with computer virus	Jean-Luc Picard	individual		
tng2x11	tng	Contagion	interest	peripheral	95	Picard and Varley in archaeology	Jean-Luc Picard, Donald Varley	individual		
tng2x12	tng	The Royale	alien point of view	central	105	the aliens had though the book was reality			Casino Royale Makers	
tng2x12	tng	The Royale	what if I was trapped in a novel	central	1509	Riker, Data, Worf	William T. Riker, Data, Worf	individual		
tng2x12	tng	The Royale	simulated reality	central	567	the aliens constructed the hotel as a simulated reality for the astronaut 				
tng2x12	tng	The Royale	facing life in captivity	central	282	Riker, Data, Worf	William T. Riker, Data, Worf	individual		
tng2x12	tng	The Royale	the need for freedom	central	187	you can't live a very fulfilling life locked in a hotel				
tng2x12	tng	The Royale	alien with alien values	central	147	the aliens thought the astronaut would be happy in this restricted fantasy world			Casino Royale Makers	
tng2x12	tng	The Royale	man vs. captivity	central	171	landing party vs. captivity in hotel	William T. Riker, Data, Worf	individual		
tng2x12	tng	The Royale	blond ditziness	peripheral	760	the blond at the poker table	Vanessa	individual		
tng2x12	tng	The Royale	non-Euclidean space	peripheral	877	the revolving doors				
tng2x12	tng	The Royale	future point of view	peripheral	215	they found an old astronaut				
tng2x12	tng	The Royale	handheld lab	peripheral	538	used to investigate the eery  planet on which the hotel was found				tricorder
tng2x12	tng	The Royale	Fermat's last theorem	peripheral	1011	Picard discussed				
tng2x12	tng	The Royale	pleasure in solving a puzzle	peripheral	558	Picard about Fermat's Last Theorem	Jean-Luc Picard	individual		
tng2x12	tng	The Royale	infatuation	peripheral	110	bellboy and Mickey D's girlfriend	bellboy	individual		
tng2x12	tng	The Royale	alien overseers	peripheral	338	Royal creators			Casino Royale Makers	
tng2x12	tng	The Royale	mysterious maker alien race	peripheral	207	Royale makers			Casino Royale Makers	
tng2x12	tng	The Royale	ennui	peripheral	236	astronaut was bored to death in that horrible story				
tng2x12	tng	The Royale	boredom	peripheral	212	Picard was bored senseless by that horrible novel	Jean-Luc Picard	individual		
tng2x12	tng	The Royale	generosity	peripheral	192	aliens toward astronaut				
tng2x12	tng	The Royale	lust	peripheral	69	the sappy love story, Texan at bimbo	Texas			
tng2x13	tng	Time Squared	time travel	central	230	Enterprise stuck in a time loop				
tng2x13	tng	Time Squared	second guessing one's self	central	150	Picard				
tng2x13	tng	Time Squared	time loop	central	726	Mobius timeline				
tng2x13	tng	Time Squared	energy vortex entity	central	1139	energy vortex entity nearly engulfed the Enterprise			Energy Vortex Entity	
tng2x13	tng	Time Squared	what if I met my double	central	442	Picard met himself	Jean-Luc Picard	individual		
tng2x13	tng	Time Squared	self-confidence	central	217	Picard's double had his confidence shaken	Jean-Luc Picard	individual		
tng2x13	tng	Time Squared	anxiety	central	402	future Picard	Jean-Luc Picard	individual		
tng2x13	tng	Time Squared	man vs. space anomaly	central	285	Enterprise crew vs. time loop				
tng2x13	tng	Time Squared	facing mysterious adversity	central	182	Enterprise crew face energy vortex				
tng2x13	tng	Time Squared	pleasure in cooking	peripheral	1299	Riker and the Owon eggs	William T. Riker	individual		
tng2x13	tng	Time Squared	selfless service	peripheral	186	Picard	Jean-Luc Picard	individual		
tng2x13	tng	Time Squared	amazement	peripheral	205	crew briefly meet themselves				
tng2x13	tng	Time Squared	apprehension	peripheral	87	future Picard	Jean-Luc Picard	individual		
tng2x14	tng	The Icarus Factor	father and son	central	164	Riker and Kyle Riker	William T. Riker/Kyle Riker	dyad		
tng2x14	tng	The Icarus Factor	reconciliation	central	185	Riker and Kyle Riker	William T. Riker/Kyle Riker	dyad		
tng2x14	tng	The Icarus Factor	male bonding	central	194	Riker and Kyle Riker	William T. Riker/Kyle Riker	dyad		
tng2x14	tng	The Icarus Factor	choosing between job opportunities	central	451	Riker about accepting the captain's chair	William T. Riker	individual		
tng2x14	tng	The Icarus Factor	the desire to advance one's career	central	254	Riker	William T. Riker	individual		
tng2x14	tng	The Icarus Factor	rivalry	central	276	Riker and Kyle Riker	William T. Riker/Kyle Riker	dyad		
tng2x14	tng	The Icarus Factor	absentee father	central	746	Kyle Riker	Kyle Riker	individual		
tng2x14	tng	The Icarus Factor	clash of wills	central	93	Riker and Kyle Riker	William T. Riker/Kyle Riker	dyad		
tng2x14	tng	The Icarus Factor	confronting an old ghost	central	371	Riker	William T. Riker	individual		
tng2x14	tng	The Icarus Factor	paternal love	central	155	Kyle to Riker	Kyle Riker	individual		
tng2x14	tng	The Icarus Factor	father and son rivalry	central	1149	Riker and Kyle Riker	William T. Riker/Kyle Riker	dyad		
tng2x14	tng	The Icarus Factor	pride	central	73	both Rikers	William T. Riker, Kyle Riker	individual		
tng2x14	tng	The Icarus Factor	filial love	central	248	Riker to Kyle	William T. Riker	individual		
tng2x14	tng	The Icarus Factor	coping with living in a foreign culture	peripheral	303	Worf	Worf	individual		
tng2x14	tng	The Icarus Factor	belonging	peripheral	136	Worf	Worf	individual		
tng2x14	tng	The Icarus Factor	cultural differences	peripheral	100	Worf in a human world				
tng2x14	tng	The Icarus Factor	captain and crew's attachment to their ship	peripheral	321	Geordi takes exception to crewman's appraisal of the Enterprise	Geordi La Forge	individual		
tng2x14	tng	The Icarus Factor	pain stick	peripheral	1280	Klingon one				Painstik
tng2x14	tng	The Icarus Factor	friendship	peripheral	144	Worf and crew	Worf/Wesley Crusher	dyad		
tng2x14	tng	The Icarus Factor	nostalgic love	peripheral	356	Pulaski and Kyle Riker	Katherine Pulaski, Kyle Riker	individual		
tng2x14	tng	The Icarus Factor	old flames	peripheral	273	Pulaski and Kyle Riker	Katherine Pulaski/Kyle Riker	dyad		
tng2x14	tng	The Icarus Factor	having a change of heart	peripheral	419	Riker about his father	William T. Riker	individual		
tng2x14	tng	The Icarus Factor	alien customs	peripheral	222	Worf's ritual				
tng2x14	tng	The Icarus Factor	anger	peripheral	86	Riker at Kyle Riker	William T. Riker	individual		
tng2x14	tng	The Icarus Factor	compassion	peripheral	80	Wesley and crew to Worf	Wesley Crusher	individual		
tng2x14	tng	The Icarus Factor	distaste for attention	peripheral	213	Worf	Worf	individual		
tng2x14	tng	The Icarus Factor	kindness	peripheral	81	Wesley and crew to Worf	Wesley Crusher	individual		
tng2x14	tng	The Icarus Factor	reclusiveness	peripheral	289	Worf	Worf	individual		
tng2x15	tng	Pen Pals	Prime Directive	central	138	Data, seconded by Picard, violates Prime Directive to save Sarjenka	Jean-Luc Picard	individual		
tng2x15	tng	Pen Pals	the ethics of the Prime Directive	central	142	Data, seconded by Picard, violates Prime Directive to save Sarjenka	Jean-Luc Picard	individual		
tng2x15	tng	Pen Pals	duty vs. compassion	central	235	Data, seconded by Picard, violates Prime Directive to save Sarjenka	Jean-Luc Picard	individual		
tng2x15	tng	Pen Pals	compassion	central	80	Data at Sarjenka	Data	individual		
tng2x15	tng	Pen Pals	kindness	central	81	Data to Sarjenka	Data	individual		
tng2x15	tng	Pen Pals	cooperation	central	159	Wesley must cooperate with team members				
tng2x15	tng	Pen Pals	the qualities of a good leader	central	165	Wesley	Wesley Crusher	individual		
tng2x15	tng	Pen Pals	mentor and protégé	central	309	Wesley and bridge crew	William T. Riker/Wesley Crusher	individual		
tng2x15	tng	Pen Pals	adolescence	central	180	Wesley	Wesley Crusher	individual		
tng2x15	tng	Pen Pals	self-confidence	central	217	Wesley given leadership assignment to bolster his self-confidence	Wesley Crusher	individual		
tng2x15	tng	Pen Pals	future point of view	central	215	Data in Sarjenka's world	Data	individual		
tng2x15	tng	Pen Pals	taking responsibility for one's actions	central	434	Data for violating Prime Directive in contacting Sarjenka	Data	individual		
tng2x15	tng	Pen Pals	coping with being separated from one's family	central	615	Sarjenka	Sarjenka	individual		
tng2x15	tng	Pen Pals	friendship	central	144	Data and Sarjenka	Data/Sarjenka	dyad		
tng2x15	tng	Pen Pals	leadership	central	132	Wesley as group leader	Wesley Crusher	individual		
tng2x15	tng	Pen Pals	AI point of view	central	137	Data	Data	individual		
tng2x15	tng	Pen Pals	coping with a loved one being in peril	central	243	Data at Sarjenka	Data	individual		
tng2x15	tng	Pen Pals	sacrifice for one's beliefs	central	391	Data violates regulation to save Sarjenka	Data	individual		
tng2x15	tng	Pen Pals	diligence	central	89	Wesley	Wesley Crusher	individual		
tng2x15	tng	Pen Pals	memory wipe	peripheral	865	Data used memory wipe on Sarjenka to get around having violated Prime Directive				
tng2x15	tng	Pen Pals	spontaneous planetary break up	peripheral	1384	Drema V was falling to pieces				Drema V
tng2x15	tng	Pen Pals	pleasure in horseback riding	peripheral	897	Picard	Jean-Luc Picard	individual		
tng2x15	tng	Pen Pals	orphanhood	peripheral	476	Sarjenka	Sarjenka	individual		
tng2x15	tng	Pen Pals	loyalty to a leader	peripheral	121	Data to Picard	Data	individual		
tng2x15	tng	Pen Pals	annoyance	peripheral	57	Davies at Wesley	Davies	individual		
tng2x15	tng	Pen Pals	anticipation	peripheral	196	Wesley about leading science team	Wesley Crusher	individual		
tng2x16	tng	Q Who	collectively intelligent aliens	central	508	Borg			Borg	
tng2x16	tng	Q Who	alien point of view	central	105	Borg			Borg	
tng2x16	tng	Q Who	desperation	central	102	Enterprise under pursuit by Borg				
tng2x16	tng	Q Who	alien with alien values	central	147	Borg			Borg	
tng2x16	tng	Q Who	collective intelligence	central	340	The Borg				
tng2x16	tng	Q Who	risk taking vs. playing it safe	central	157	the Federation venturing out into space				
tng2x16	tng	Q Who	fear for one's life	central	461	Enterprise crew				
tng2x16	tng	Q Who	fear	central	139	crew upon encountering the Borg				
tng2x16	tng	Q Who	charting unknown territory	central	301	Picard stays to explore new sector of galaxy in which Q has placed them				
tng2x16	tng	Q Who	transcendental alien	central	221	Q			The Q	
tng2x16	tng	Q Who	cyborg	central	410	The Borg			Borg	
tng2x16	tng	Q Who	hubris	central	228	Human race				
tng2x16	tng	Q Who	the thirst for knowledge	central	158	Picard stays to explore new sector of galaxy in which Q has placed them	Jean-Luc Picard	individual		
tng2x16	tng	Q Who	facing a mortal enemy	central	91	Enterprise crew face the Borg				
tng2x16	tng	Q Who	man vs. machine	central	195	Enterprise crew vs. Borg				
tng2x16	tng	Q Who	facing an overpowering adversary	central	258	Enterprise crew face the Borg				
tng2x16	tng	Q Who	passion for space exploration	peripheral	477	Picard stays to explore new sector of galaxy in which Q has placed them	Jean-Luc Picard	individual		
tng2x16	tng	Q Who	be mindful of first impressions	peripheral	1057	Sonya Gomez made a terrible first impression				
tng2x16	tng	Q Who	AI rights	peripheral	255	politeness towards replicator AI				
tng2x16	tng	Q Who	anxiety	peripheral	402	crew in the presence of Borg threat				
tng2x16	tng	Q Who	courtesy	peripheral	782	Sonya thanks replicator	Sonya Gomez	individual		
tng2x16	tng	Q Who	the desire to advance one's career	peripheral	254	Sonya	Sonya Gomez	individual		
tng2x16	tng	Q Who	swallowing one's pride	peripheral	702	Picard begging Q for help	Jean-Luc Picard	individual		
tng2x16	tng	Q Who	lesson in humility	peripheral	153	Picard	Jean-Luc Picard	individual		
tng2x16	tng	Q Who	attack from outer space by a powerful conquering alien race	peripheral	404	concern of Borg invasion				
tng2x16	tng	Q Who	relentless enemy	peripheral	561	Borg			Borg	
tng2x16	tng	Q Who	coping with the death of a subordinate	peripheral	270	Picard about 18 crewmen	Jean-Luc Picard	individual		
tng2x16	tng	Q Who	anger	peripheral	86	Worf at Q	Worf	individual		
tng2x16	tng	Q Who	disgust	peripheral	120	Picard at Q	Jean-Luc Picard	individual		
tng2x16	tng	Q Who	grief	peripheral	63	18 crewmen died				
tng2x16	tng	Q Who	interest	peripheral	95	Picard stays to explore sector	Jean-Luc Picard	individual		
tng2x16	tng	Q Who	wrath	peripheral	56	Worf at Q	Worf	individual		
tng2x16	tng	Q Who	pride	peripheral	73	Q	Q	individual		
tng2x17	tng	Samaritan Snare	spacefaring aliens with primitive minds	central	359	Pakled			Pakled	
tng2x17	tng	Samaritan Snare	self-image	central	392	Picard didn't want to crew to know he suffered from a heart condition	Jean-Luc Picard	individual		
tng2x17	tng	Samaritan Snare	humility	central	114	Picard about his own mortality	Jean-Luc Picard	individual		
tng2x17	tng	Samaritan Snare	avarice	central	128	Pakled	Grebnedlog, Reginod	individual		
tng2x17	tng	Samaritan Snare	the lust for gold	central	163	Pakled	Grebnedlog, Reginod	individual		
tng2x17	tng	Samaritan Snare	facing a hostage situation	central	415	Pakled take Geordi hostage				
tng2x17	tng	Samaritan Snare	generosity	central	192	Riker stops to help Pakled	William T. Riker	individual		
tng2x17	tng	Samaritan Snare	clash of wills	peripheral	93	Picard and Pulaski	Jean-Luc Picard/Katherine Pulaski	dyad		
tng2x17	tng	Samaritan Snare	male bonding	peripheral	194	Picard and Wesley	Jean-Luc Picard/Wesley Crusher	dyad		
tng2x17	tng	Samaritan Snare	imitativeness	peripheral	540	Pakled	Grebnedlog, Reginod	individual		
tng2x17	tng	Samaritan Snare	pulsar	peripheral	560	Enterprise was on a mission to observe a pulsar				
tng2x17	tng	Samaritan Snare	the need to maintain an image	peripheral	954	Picard didn't want to crew to know he suffered from a heart condition	Jean-Luc Picard	individual		
tng2x17	tng	Samaritan Snare	man vs. captivity	peripheral	171	Geordi by Pakleds	Geordi La Forge	individual		
tng2x17	tng	Samaritan Snare	kindness	peripheral	81	Geordi to Pakled	Geordi La Forge	individual		
tng2x17	tng	Samaritan Snare	sloth	peripheral	162	Pakled	Grebnedlog, Reginod	individual		
tng2x17	tng	Samaritan Snare	patience	peripheral	103	Geordi in dealing with Pakled	Geordi La Forge	individual		
tng2x18	tng	Up The Long Ladder	cooperation	central	159	the Bringloidi and Mariposans must mate together to survive				
tng2x18	tng	Up The Long Ladder	the morality of human cloning	central	711	Riker appalled to find that he had been surreptitiously cloned				
tng2x18	tng	Up The Long Ladder	neo-luddist utopia	central	549	Bringloid			Bringloidi	
tng2x18	tng	Up The Long Ladder	genetic engineering utopia	central	829	Mariposans			Mariposan	
tng2x18	tng	Up The Long Ladder	space Irish	central	1367	Bringloid			Bringloidi	
tng2x18	tng	Up The Long Ladder	desperation	central	102	Mariposans clone Riker in a desperate bid to increases their breeding stock				
tng2x18	tng	Up The Long Ladder	human cloning	central	656	Mariposans rely on cloning to reproduce				
tng2x18	tng	Up The Long Ladder	abortion	central	745	Riker wanted to abort his clone				
tng2x18	tng	Up The Long Ladder	mediation	central	263	Picard between Bringloidi and Mariposans				
tng2x18	tng	Up The Long Ladder	there is value in diversity	central	967	Mariposan society nearly collapsed because it relied on just a few clones				
tng2x18	tng	Up The Long Ladder	doctor-patient confidentiality	central	627	Pulaski helped Worf save face by not disclosing to the crew that he was sick				
tng2x18	tng	Up The Long Ladder	planet scorching solar flare	central	1294	Bringlodi had to leave their home planet because of solar flares			Bringloidi	
tng2x18	tng	Up The Long Ladder	cloning-related replicative fading	central	1082	Mariposans were on the brink of extinction			Mariposan	
tng2x18	tng	Up The Long Ladder	surviving an existential risk	central	218	Mariposans surviving the replicative fading			Mariposan	
tng2x18	tng	Up The Long Ladder	space colonization	peripheral	433	Irish went out to found a colony of their own out in space				
tng2x18	tng	Up The Long Ladder	shame	peripheral	358	Worf after fainting on the bridge	Worf	individual		
tng2x18	tng	Up The Long Ladder	infatuation	peripheral	110	Riker and Brenna	William T. Riker/Brenna Odell	dyad		
tng2x18	tng	Up The Long Ladder	the qualities of a good wife	peripheral	958	Danilo makes the case for his daughter	Brenna Odell	individual		
tng2x18	tng	Up The Long Ladder	generation loss	peripheral	1173	replicative fading				
tng2x18	tng	Up The Long Ladder	father and daughter	peripheral	247	Danilo and Brenna	Danilo Odell/Brenna Odell	dyad		
tng2x18	tng	Up The Long Ladder	coping with unwelcome romantic attention	peripheral	234	Picard when Danilo offers daughter in marriage	Jean-Luc Picard	individual		
tng2x18	tng	Up The Long Ladder	cultural differences	peripheral	100	Humans and the space Irish				
tng2x18	tng	Up The Long Ladder	pride	peripheral	73	Mariposans at Bringloids	Wilson Granger	individual		
tng2x18	tng	Up The Long Ladder	annoyance	peripheral	57	Picard at Space Irish antics	Jean-Luc Picard	individual		
tng2x18	tng	Up The Long Ladder	chastity	peripheral	175	Picard declines Danilo Odell's offer of daughter's hand in marriage	Jean-Luc Picard	individual		
tng2x18	tng	Up The Long Ladder	ecstasy	peripheral	177	Riker at foot massage	William T. Riker	individual		
tng2x18	tng	Up The Long Ladder	gluttony	peripheral	178	Danilo Odell brewing beer	Danilo Odell	individual		
tng2x18	tng	Up The Long Ladder	hospitality	peripheral	104	Picard to Space Irish	Jean-Luc Picard	individual		
tng2x18	tng	Up The Long Ladder	lust	peripheral	69	Riker at Brenna Odell	William T. Riker	individual		
tng2x18	tng	Up The Long Ladder	patience	peripheral	103	Picard to Space Irish	Jean-Luc Picard	individual		
tng2x18	tng	Up The Long Ladder	sloth	peripheral	162	Danilo Odell	Danilo Odell	individual		
tng2x18	tng	Up The Long Ladder	surprise	peripheral	115	Space Irish about Enterprise customs	Danilo Odell	individual		
tng2x19	tng	Manhunt	coping with menopause	central	1103	Lwaxana with Betazoid PMS	Lwaxana Troi	individual		
tng2x19	tng	Manhunt	unrequited love	central	122	Lwaxana at Picard	Lwaxana Troi	individual		
tng2x19	tng	Manhunt	obsessive infatuation	central	386	Lwaxana at Picard	Lwaxana Troi	individual		
tng2x19	tng	Manhunt	mother and daughter	central	355	Lwaxana and Troi	Lwaxana Troi/Deanna Troi	individual		
tng2x19	tng	Manhunt	the need for companionship	central	362	Lwaxana about finding a husband	Lwaxana Troi	individual		
tng2x19	tng	Manhunt	lust	central	69	Lwaxana for Picard and Rex	Lwaxana Troi	individual		
tng2x19	tng	Manhunt	future point of view	central	215	Picard about 20th century	Jean-Luc Picard	individual		
tng2x19	tng	Manhunt	hibernating alien	central	831	Antedeans			Antedean	
tng2x19	tng	Manhunt	telepathic alien	central	219	Betazoid			Betazoid	
tng2x19	tng	Manhunt	obsession	central	141	Lwaxana with finding a husband	Lwaxana Troi	individual		
tng2x19	tng	Manhunt	love at first sight	peripheral	543	Lwaxana instantly infatuated with Rex the bartender	Lwaxana Troi	individual		
tng2x19	tng	Manhunt	political assassination	peripheral	428	Antedean assassins discovered by Lwaxana				
tng2x19	tng	Manhunt	fish-like alien	peripheral	821	Antedeans			Antedean	
tng2x19	tng	Manhunt	prejudice	peripheral	208	The last major human prejudice is against ugliness according to Data; recurring theme with the Antedean dignitaries				
tng2x19	tng	Manhunt	lookism in society	peripheral	853	Antedean were ugly as hell				
tng2x19	tng	Manhunt	determination	peripheral	324	Lwaxana in finding a husband	Lwaxana Troi	individual		
tng2x19	tng	Manhunt	embarrassment	peripheral	380	Picard exposed by Lwaxana for harboring dirty thoughts in his mind	Jean-Luc Picard	individual		
tng2x19	tng	Manhunt	world with telepathy	peripheral	267	Lwaxana foiling the assassins				
tng2x19	tng	Manhunt	coping with unwelcome romantic attention	peripheral	234	Picard at Lwaxana	Jean-Luc Picard	individual		
tng2x19	tng	Manhunt	annoyance	peripheral	57	Picard and Troi by Lwaxana	Jean-Luc Picard	individual		
tng2x19	tng	Manhunt	boredom	peripheral	212	Lwaxana by Data's dinner conversation	Lwaxana Troi	individual		
tng2x19	tng	Manhunt	virtual reality room	peripheral	135	Picard retreated to holodeck to escape Lwaxana's romantic attentions				holodeck
tng2x20	tng	The Emissary	nostalgic love	central	356	Worf and K'Ehleyr	Worf, K'Ehleyr	individual		
tng2x20	tng	The Emissary	old flames	central	273	Worf and K'Ehleyr	Worf/K'Ehleyr	dyad		
tng2x20	tng	The Emissary	suicide bombing	central	929	the Klingon sleeper ship crew had been sent on a terrorist mission				
tng2x20	tng	The Emissary	honor	central	183	Worf in his relationship with K'Ehleyr; Klingons generally	Worf	individual		
tng2x20	tng	The Emissary	there is always a third course	central	966	Picard does not accept that blowing up the Klingon sleeper vessel is the only option				
tng2x20	tng	The Emissary	multicultural upbringing	central	1259	Troy and K'Ehleyr	Deanna Troi, K'Ehleyr	individual		
tng2x20	tng	The Emissary	cooperation	central	159	Worf and K'Ehleyr	Worf/K'Ehleyr	dyad		
tng2x20	tng	The Emissary	reconciliation	central	185	Worf and K'Ehleyr	Worf/K'Ehleyr	dyad		
tng2x20	tng	The Emissary	putting differences aside	central	210	Worf and K'Ehleyr	Worf/K'Ehleyr	dyad		
tng2x20	tng	The Emissary	über-belligerent alien	central	203	Klingon			Klingon	
tng2x20	tng	The Emissary	military bluffing	central	866	Worf bluffs at poker and Klingons at end				
tng2x20	tng	The Emissary	sleeper starship	peripheral	923	Klingon sleeper vessel				
tng2x20	tng	The Emissary	suspended animation	peripheral	701	K'Ehleyr was put in suspended animation for her voyage to the Enterprise				
tng2x20	tng	The Emissary	bluffing	peripheral	598	Worf at the poker table	Worf	individual		
tng2x20	tng	The Emissary	virtual reality room	peripheral	135	Worf's calisthenics program				holodeck
tng2x20	tng	The Emissary	sleeper agents	peripheral	1356	Klingon sleeper vessel agents				
tng2x20	tng	The Emissary	lovers' quarrel	peripheral	425	Worf and K'Ehleyr	Worf/K'Ehleyr	dyad		
tng2x20	tng	The Emissary	chastity	peripheral	175	Worf insists KEhleyr follow Klingon mating customs	Worf	individual		
tng2x20	tng	The Emissary	diligence	peripheral	89	Worf as opposed to KEhlyhr	Worf	individual		
tng2x20	tng	The Emissary	distraction	peripheral	148	Worf by K'Ehleyr	Worf	individual		
tng2x20	tng	The Emissary	lust	peripheral	69	Worf and K'Ehleyr for one another on the holodeck	Worf, K'Ehleyr	individual		
tng2x20	tng	The Emissary	personal conviction	peripheral	126	Picard about not killing rogue Klingons	Jean-Luc Picard	individual		
tng2x20	tng	The Emissary	rage	peripheral	92	Worf and K'Ehleyr	Worf, K'Ehleyr	individual		
tng2x20	tng	The Emissary	sloth	peripheral	162	K'Elyhr late to her duty	K'Ehleyr	individual		
tng2x20	tng	The Emissary	surprise	peripheral	115	Worf at arrival of K'Ehleyr	Worf	individual		
tng2x20	tng	The Emissary	tardiness	peripheral	293	K'Ehleyr was late for duty	K'Ehleyr	individual		
tng2x20	tng	The Emissary	wrath	peripheral	56	K'Ehleyr smashes glass table	K'Ehleyr	individual		
